{
  "schema_version": 1,
  "surface_id": "runtime_continuity_social_hub",
  "surface_path": "runtime/http/index.html",
  "template_id": "continuity_social_hub_v1",
  "preserve": [
    "social-feed hierarchy",
    "composer-first participation",
    "thread/reply lineage",
    "source-system provenance",
    "navigation identity and activity context",
    "time attached to entries without becoming the page structure"
  ],
  "local_additions": [
    "ohayo activation entrance",
    "live handoff and attention data projected as feed activity",
    "supporting notes/plans/tasks/reminders behind social-style entry points",
    "future Online School, Factory, research, jobs, and other system sources",
    "global cross-system search",
    "portal modules for direct access to connected domains",
    "one Continuity identity across linked external providers"
  ],
  "deviations": [
    "Internal movement anchors remain available to pipes/calendar but are not part of the visible homepage taxonomy."
  ],
  "last_reviewed": "2026-10-06"
}
